subreddit,title,body,author,upvotes,num_comments,timestamp,cleaned_title,cleaned_body,full_text,cleaned_full_text
mentalhealth,Are men under 30 ruined?,"I’m in my early 50s. White dude from a small farm town. My generation had its problems. Divorce. Alcoholism. Drug abuse. Bullying. Abusive parents. Dysfunctional extended family. School authorities were corrupt. Cops sucked. The most repugnant edgelords of my generation were probably Nirvana and Beavis and Butthead - both culturally cataclysmic. They seemed to point out a problem with cathartic noise or a healthy sense of humor. But being stupid, ignorant or mean was never a cause to be celebrated. The cultural implication seemed to be that those traits were still meant to be resisted and aged out of. Until then, skateboarding and playing rock ‘n’ roll would get me through.

It was a fucking paradise compared to now. I’m speaking of the post-internet reality for young men specifically.

The lives of men raised online seem to have been completely retarded. Their lives were deprived of the development of mirror neurons or authentic chances to experience empathy or whatever family system they grew up in was completely usurped by the internet and video games and people behaving very, very, very badly online. Either way, the result seems to be that their moral compass is based on the indulgence of other people’s worst fantasies.

Now it is completely normal for someone to go online and spew the most dissociated, vile hate I’ve ever had the displeasure of being witness to.

Nirvana and Beavis and Butthead gave way to the “I don’t care if you don’t care” attitude of the 2000s which gave way to 4Chan and the celebration of not just ignorance, but of abject cruelty. I argue it's what has landed us here.

I know that there are always generational divides. I’m aware that this could be construed simply as a “get off my lawn” letter. But I always have always advocated for kids - especially when other adults didn't. ""Adults"" don’t know what they’re doing most of the time anyway.

But this recent thing - this is not “you crazy kids with your loud music and your long hair running off to rock concerts, getting drunk on the weekends or dropping out of school to travel in Europe.” It’s not “I’m worried about this rap or Satanic Heavy Metal music you listen to” or “you play too much Nintendo - go outside and ride your bike.”

This is celebrating Hitler. Incels. Groypers. It’s the glorification of hate and the killing of other people - specifically the most vulnerable among us.

This seems to be a completely ubiquitous epidemic of mental illness the likes of which we have never seen as a species, but it seems to be the only perceivable reality for certain young men.

Entire generations are throwing their lives into the meat grinder of a 24 hour news cycle. Seems to me that's nothing but a dark fiction with a shit ending for everyone. But I also don’t see this going away with the wisdom of old age. I argue that we either fix this or we fix nothing.

Young men - am I wrong or right? If so, please tell me why.",[deleted],171,131,2025-12-02 07:17:07+00:00,men ruined,im early white dude small farm town generation problems divorce alcoholism drug abuse bullying abusive parents dysfunctional extended family school authorities corrupt cops sucked repugnant edgelords generation probably nirvana beavis butthead culturally cataclysmic seemed point problem cathartic noise healthy sense humor stupid ignorant mean never cause celebrated cultural implication seemed traits meant resisted aged skateboarding playing rock n roll fucking paradise compared im speaking postinternet reality young men specifically lives men raised online seem completely retarded lives deprived development mirror neurons authentic chances experience empathy whatever family system grew completely usurped internet video games behaving badly online either way result seems moral compass based indulgence peoples worst fantasies completely normal someone online spew dissociated vile hate ive ever displeasure witness nirvana beavis butthead gave way dont care dont care attitude gave way chan celebration ignorance abject cruelty argue landed us always generational divides im aware construed simply lawn letter always always advocated kids especially adults didnt adults dont theyre time anyway recent crazy kids loud music long hair running rock concerts getting drunk weekends dropping school travel europe im worried rap satanic heavy metal music listen play nintendo outside ride bike celebrating hitler incels groypers glorification hate killing specifically vulnerable among us seems completely ubiquitous epidemic mental illness likes never seen species seems perceivable reality certain young men entire generations throwing lives meat grinder hour news cycle seems thats nothing dark fiction shit ending everyone dont going away wisdom old age argue either fix fix nothing young men wrong right please tell,"Are men under 30 ruined? I’m in my early 50s. White dude from a small farm town. My generation had its problems. Divorce. Alcoholism. Drug abuse. Bullying. Abusive parents. Dysfunctional extended family. School authorities were corrupt. Cops sucked. The most repugnant edgelords of my generation were probably Nirvana and Beavis and Butthead - both culturally cataclysmic. They seemed to point out a problem with cathartic noise or a healthy sense of humor. But being stupid, ignorant or mean was never a cause to be celebrated. The cultural implication seemed to be that those traits were still meant to be resisted and aged out of. Until then, skateboarding and playing rock ‘n’ roll would get me through.

It was a fucking paradise compared to now. I’m speaking of the post-internet reality for young men specifically.

The lives of men raised online seem to have been completely retarded. Their lives were deprived of the development of mirror neurons or authentic chances to experience empathy or whatever family system they grew up in was completely usurped by the internet and video games and people behaving very, very, very badly online. Either way, the result seems to be that their moral compass is based on the indulgence of other people’s worst fantasies.

Now it is completely normal for someone to go online and spew the most dissociated, vile hate I’ve ever had the displeasure of being witness to.

Nirvana and Beavis and Butthead gave way to the “I don’t care if you don’t care” attitude of the 2000s which gave way to 4Chan and the celebration of not just ignorance, but of abject cruelty. I argue it's what has landed us here.

I know that there are always generational divides. I’m aware that this could be construed simply as a “get off my lawn” letter. But I always have always advocated for kids - especially when other adults didn't. ""Adults"" don’t know what they’re doing most of the time anyway.

But this recent thing - this is not “you crazy kids with your loud music and your long hair running off to rock concerts, getting drunk on the weekends or dropping out of school to travel in Europe.” It’s not “I’m worried about this rap or Satanic Heavy Metal music you listen to” or “you play too much Nintendo - go outside and ride your bike.”

This is celebrating Hitler. Incels. Groypers. It’s the glorification of hate and the killing of other people - specifically the most vulnerable among us.

This seems to be a completely ubiquitous epidemic of mental illness the likes of which we have never seen as a species, but it seems to be the only perceivable reality for certain young men.

Entire generations are throwing their lives into the meat grinder of a 24 hour news cycle. Seems to me that's nothing but a dark fiction with a shit ending for everyone. But I also don’t see this going away with the wisdom of old age. I argue that we either fix this or we fix nothing.

Young men - am I wrong or right? If so, please tell me why.",men ruined im early white dude small farm town generation problems divorce alcoholism drug abuse bullying abusive parents dysfunctional extended family school authorities corrupt cops sucked repugnant edgelords generation probably nirvana beavis butthead culturally cataclysmic seemed point problem cathartic noise healthy sense humor stupid ignorant mean never cause celebrated cultural implication seemed traits meant resisted aged skateboarding playing rock n roll fucking paradise compared im speaking postinternet reality young men specifically lives men raised online seem completely retarded lives deprived development mirror neurons authentic chances experience empathy whatever family system grew completely usurped internet video games behaving badly online either way result seems moral compass based indulgence peoples worst fantasies completely normal someone online spew dissociated vile hate ive ever displeasure witness nirvana beavis butthead gave way dont care dont care attitude gave way chan celebration ignorance abject cruelty argue landed us always generational divides im aware construed simply lawn letter always always advocated kids especially adults didnt adults dont theyre time anyway recent crazy kids loud music long hair running rock concerts getting drunk weekends dropping school travel europe im worried rap satanic heavy metal music listen play nintendo outside ride bike celebrating hitler incels groypers glorification hate killing specifically vulnerable among us seems completely ubiquitous epidemic mental illness likes never seen species seems perceivable reality certain young men entire generations throwing lives meat grinder hour news cycle seems thats nothing dark fiction shit ending everyone dont going away wisdom old age argue either fix fix nothing young men wrong right please tell
mentalhealth,I've ruined my life at the age of 19,"I'm 19 in my second year of college and I already feel like my life is ruined. Completely worthless. I hate my life because of the things I've done. I have a porn addiction that just wont go away. I can go clean for 5 days straight but then by the sixth day I explode and watch porn 3 - 4 times in one day and I feel horrible. I go on social media apps speaking to multiple different girls hoping they'll send me nudes, I did this all throughout high school as well. I feel awful about it and everything I've ever done. I'm a monster in my own eyes. Relationships don't work for me, I have no confidence in myself and girls can see that. I'm starting to think about taking the easy way out more often as it would be so much easier than having to think about who I am as a person. I hate everything about me. I'm ruined and I don't see a way to continue without being partially depressed all the time. If anyone has any advice for me please let me know, because I'm just about done being here.",Pu55ieDestroyer9000,70,33,2025-12-02 04:29:38+00:00,ive ruined life age,im second year college already feel life ruined completely worthless hate life ive done porn addiction wont away clean days straight sixth day explode watch porn times day feel horrible social media apps speaking multiple different girls hoping theyll send nudes throughout high school well feel awful everything ive ever done im monster eyes relationships dont work confidence girls im starting taking easy way often easier person hate everything im ruined dont way continue without partially depressed time anyone advice please let im done,"I've ruined my life at the age of 19 I'm 19 in my second year of college and I already feel like my life is ruined. Completely worthless. I hate my life because of the things I've done. I have a porn addiction that just wont go away. I can go clean for 5 days straight but then by the sixth day I explode and watch porn 3 - 4 times in one day and I feel horrible. I go on social media apps speaking to multiple different girls hoping they'll send me nudes, I did this all throughout high school as well. I feel awful about it and everything I've ever done. I'm a monster in my own eyes. Relationships don't work for me, I have no confidence in myself and girls can see that. I'm starting to think about taking the easy way out more often as it would be so much easier than having to think about who I am as a person. I hate everything about me. I'm ruined and I don't see a way to continue without being partially depressed all the time. If anyone has any advice for me please let me know, because I'm just about done being here.",ive ruined life age im second year college already feel life ruined completely worthless hate life ive done porn addiction wont away clean days straight sixth day explode watch porn times day feel horrible social media apps speaking multiple different girls hoping theyll send nudes throughout high school well feel awful everything ive ever done im monster eyes relationships dont work confidence girls im starting taking easy way often easier person hate everything im ruined dont way continue without partially depressed time anyone advice please let im done
mentalhealth,Bf’s mom covered my mouth while im having panic attacks. Is that abuse?,"Hi everyone. I really need an outside perspective because I feel shaken, confused, and honestly scared. I’m staying with my family right now, trying to process everything.

A few days ago I had a severe panic attack, the worst one I’ve ever had. Honestly idk becahse it was my first time experiencing it. My whole body froze up, I couldn’t move, I was crying uncontrollably, and I felt like I couldn’t breathe. I genuinely thought I was going to pass out. I thought i was having a stroke because my mom and grandpa had it. No one in the family has ever had mental health issues like panic attack so this is new to me.

My boyfriend tried to “handle” me for about an hour, but then he suddenly got frustrated. I kept begging him to take me to the hospital because I couldn’t breathe or move, but he refused. My mom lives 3 hours away and called him in the middle of the night, telling him to take me to the ER immediately — he still refused. He insisted I’d “be better at home” and told me he didn’t want to “wait in line at the ER for this.”

I told him I was terrified and begged, “Please don’t leave me alone, I’m scared,” and he said, “No, I’m tired of dealing with you.” Then he left me alone, closed the door, and almost turned off all the lights while I was frozen and screaming for help.

I kept crying and yelling that I couldn’t breathe. He eventually came back, not to help, but to yell: “Are you trying to get me arrested?! You’re waking the basement tenants!”

The next morning things got even worse. His mom came over, immediately yelling at me while I was still shaking, crying, and unable to move properly. At one point she said, “If you don’t stop, I’m going to slap you,” and then she covered my mouth with her hand while I was crying and struggling to breathe. And said oh you need to be taken away and be in a psych for a week.

I can’t describe how terrifying that felt. I literally could not move, can’t stop crying even though my brain wants to stop and someone put their hand over my mouth.

When my body slipped partly off the bed, they laughed and said, “Oh, now you can move.” His mom kept provoking me by saying, “What do you want to do, punch me?” “Go ahead punch me right now” while I could barely talk.

My boyfriend eventually said you can’t treat her like how you treat me. And she was flabbergasted. After i was taken to the hospital which was 12 hrs after the incident even though i was begging for 12 hrs to take me to the hospital, my family came to get me. So i slept with my family the whole time after. The next day he messaged me and said, “If you weren’t being a bitch, you’d be comfortable in bed and jn the office in the house right now.” In a very sarcastic tone.

I left and I’m staying with my family now. I don’t feel safe going back, but I also feel confused and guilty. I keep replaying everything and questioning myself.

Was this abuse? Or am I overreacting because I was scared and having a panic attack? They kept saying to me that they just didnmt know how to handle it that’s why thats there reaction. I genuinely need honest perspective",Psychological_Ant747,60,61,2025-12-02 12:09:17+00:00,bfs mom covered mouth im panic attacks abuse,hi everyone outside perspective feel shaken confused honestly scared im staying family right trying process everything days ago severe panic attack worst ive ever honestly idk becahse first time experiencing whole body froze couldnt move crying uncontrollably felt couldnt breathe genuinely thought going pass thought stroke mom grandpa family ever mental health issues panic attack new boyfriend tried handle hour suddenly got frustrated kept begging hospital couldnt breathe move refused mom lives hours away called middle night telling er immediately refused insisted id better home told didnt wait line er told terrified begged please dont leave alone im scared im tired dealing left alone closed door almost turned lights frozen screaming help kept crying yelling couldnt breathe eventually came back help yell trying arrested youre waking basement tenants next morning got worse mom came immediately yelling shaking crying unable move properly point dont stop im going slap covered mouth hand crying struggling breathe oh taken away psych week cant describe terrifying felt literally move cant stop crying though brain wants stop someone put hand mouth body slipped partly bed laughed oh move mom kept provoking saying punch ahead punch right barely talk boyfriend eventually cant treat treat flabbergasted taken hospital hrs incident though begging hrs hospital family came slept family whole time next day messaged werent bitch youd comfortable bed jn office house right sarcastic tone left im staying family dont feel safe going back feel confused guilty keep replaying everything questioning abuse overreacting scared panic attack kept saying didnmt handle thats thats reaction genuinely honest perspective,"Bf’s mom covered my mouth while im having panic attacks. Is that abuse? Hi everyone. I really need an outside perspective because I feel shaken, confused, and honestly scared. I’m staying with my family right now, trying to process everything.

A few days ago I had a severe panic attack, the worst one I’ve ever had. Honestly idk becahse it was my first time experiencing it. My whole body froze up, I couldn’t move, I was crying uncontrollably, and I felt like I couldn’t breathe. I genuinely thought I was going to pass out. I thought i was having a stroke because my mom and grandpa had it. No one in the family has ever had mental health issues like panic attack so this is new to me.

My boyfriend tried to “handle” me for about an hour, but then he suddenly got frustrated. I kept begging him to take me to the hospital because I couldn’t breathe or move, but he refused. My mom lives 3 hours away and called him in the middle of the night, telling him to take me to the ER immediately — he still refused. He insisted I’d “be better at home” and told me he didn’t want to “wait in line at the ER for this.”

I told him I was terrified and begged, “Please don’t leave me alone, I’m scared,” and he said, “No, I’m tired of dealing with you.” Then he left me alone, closed the door, and almost turned off all the lights while I was frozen and screaming for help.

I kept crying and yelling that I couldn’t breathe. He eventually came back, not to help, but to yell: “Are you trying to get me arrested?! You’re waking the basement tenants!”

The next morning things got even worse. His mom came over, immediately yelling at me while I was still shaking, crying, and unable to move properly. At one point she said, “If you don’t stop, I’m going to slap you,” and then she covered my mouth with her hand while I was crying and struggling to breathe. And said oh you need to be taken away and be in a psych for a week.

I can’t describe how terrifying that felt. I literally could not move, can’t stop crying even though my brain wants to stop and someone put their hand over my mouth.

When my body slipped partly off the bed, they laughed and said, “Oh, now you can move.” His mom kept provoking me by saying, “What do you want to do, punch me?” “Go ahead punch me right now” while I could barely talk.

My boyfriend eventually said you can’t treat her like how you treat me. And she was flabbergasted. After i was taken to the hospital which was 12 hrs after the incident even though i was begging for 12 hrs to take me to the hospital, my family came to get me. So i slept with my family the whole time after. The next day he messaged me and said, “If you weren’t being a bitch, you’d be comfortable in bed and jn the office in the house right now.” In a very sarcastic tone.

I left and I’m staying with my family now. I don’t feel safe going back, but I also feel confused and guilty. I keep replaying everything and questioning myself.

Was this abuse? Or am I overreacting because I was scared and having a panic attack? They kept saying to me that they just didnmt know how to handle it that’s why thats there reaction. I genuinely need honest perspective",bfs mom covered mouth im panic attacks abuse hi everyone outside perspective feel shaken confused honestly scared im staying family right trying process everything days ago severe panic attack worst ive ever honestly idk becahse first time experiencing whole body froze couldnt move crying uncontrollably felt couldnt breathe genuinely thought going pass thought stroke mom grandpa family ever mental health issues panic attack new boyfriend tried handle hour suddenly got frustrated kept begging hospital couldnt breathe move refused mom lives hours away called middle night telling er immediately refused insisted id better home told didnt wait line er told terrified begged please dont leave alone im scared im tired dealing left alone closed door almost turned lights frozen screaming help kept crying yelling couldnt breathe eventually came back help yell trying arrested youre waking basement tenants next morning got worse mom came immediately yelling shaking crying unable move properly point dont stop im going slap covered mouth hand crying struggling breathe oh taken away psych week cant describe terrifying felt literally move cant stop crying though brain wants stop someone put hand mouth body slipped partly bed laughed oh move mom kept provoking saying punch ahead punch right barely talk boyfriend eventually cant treat treat flabbergasted taken hospital hrs incident though begging hrs hospital family came slept family whole time next day messaged werent bitch youd comfortable bed jn office house right sarcastic tone left im staying family dont feel safe going back feel confused guilty keep replaying everything questioning abuse overreacting scared panic attack kept saying didnmt handle thats thats reaction genuinely honest perspective
mentalhealth,How did you friends and family react when you told them you were struggling?,"I want to open up to my family and friends about my struggles to try and get some professional help, but I’m scared. So I was wondering how your family and/or friends reacted when you told them?",Dorkas_ok,9,8,2025-12-02 18:59:33+00:00,friends family react told struggling,open family friends struggles try professional help im scared wondering family andor friends reacted told,"How did you friends and family react when you told them you were struggling? I want to open up to my family and friends about my struggles to try and get some professional help, but I’m scared. So I was wondering how your family and/or friends reacted when you told them?",friends family react told struggling open family friends struggles try professional help im scared wondering family andor friends reacted told
mentalhealth,What are some easy simple task that can improve your mental health?,Sleeping 8 hours everyday ,Ok-Reporter-8728,8,9,2025-12-02 10:01:13+00:00,easy simple task improve mental health,sleeping hours everyday,What are some easy simple task that can improve your mental health? Sleeping 8 hours everyday ,easy simple task improve mental health sleeping hours everyday
