subreddit,title,body,author,upvotes,num_comments,timestamp,cleaned_title,cleaned_body,full_text,cleaned_full_text
AskReddit,"What is a ""poor person hack"" you picked up during a hard time that you still use today, even if you don't have to?",,AmaraMehdi,11499,4489,2025-12-02 00:29:02+00:00,poor person hack picked hard time use today dont,,"What is a ""poor person hack"" you picked up during a hard time that you still use today, even if you don't have to? ",poor person hack picked hard time use today dont
AskReddit,"Who died believing themselves a failure, but was judged otherwise by history?",,Bob_the_blacksmith,4581,1899,2025-12-02 11:36:10+00:00,died believing failure judged otherwise history,,"Who died believing themselves a failure, but was judged otherwise by history? ",died believing failure judged otherwise history
AskReddit,What is the biggest signal he/she wanted to have sex that you didnt get?,,Aliyaowo,4398,1364,2025-12-02 03:26:29+00:00,biggest signal heshe wanted sex didnt,,What is the biggest signal he/she wanted to have sex that you didnt get? ,biggest signal heshe wanted sex didnt
AskReddit,"What is a song that is really dirty, yet most people don't realize it?",,_Volly,1885,2122,2025-12-02 02:16:01+00:00,song dirty yet dont realize,,"What is a song that is really dirty, yet most people don't realize it? ",song dirty yet dont realize
AskReddit,What change is coming that people aren't prepared for at all?,,nunash,1173,1261,2025-12-02 13:13:20+00:00,change coming arent prepared,,What change is coming that people aren't prepared for at all? ,change coming arent prepared
AskReddit,"How can Trump claim to be killing drug mules for national security but pardons Honduras former President, a convicted drug trafficker? Does everyone see the hypocrisy in that thought process?",,TheTokist,1115,184,2025-12-02 18:20:24+00:00,trump claim killing drug mules national security pardons honduras former president convicted drug trafficker everyone hypocrisy thought process,,"How can Trump claim to be killing drug mules for national security but pardons Honduras former President, a convicted drug trafficker? Does everyone see the hypocrisy in that thought process? ",trump claim killing drug mules national security pardons honduras former president convicted drug trafficker everyone hypocrisy thought process
AskReddit,What’s the scariest WW2 fact or story that you know of?,,Cool-Chipmunk-7559,683,846,2025-12-02 05:35:30+00:00,whats scariest ww fact story,,What’s the scariest WW2 fact or story that you know of? ,whats scariest ww fact story
AskReddit,How is the relationship between you and the person who took your virginity?,,JAGAAAN-01,669,1377,2025-12-02 09:42:19+00:00,relationship person took virginity,,How is the relationship between you and the person who took your virginity? ,relationship person took virginity
AskReddit,"Redditors who have worked with celebrities, what don't we know about them?",,22m_spain,633,1193,2025-12-02 11:18:46+00:00,redditors worked celebrities dont,,"Redditors who have worked with celebrities, what don't we know about them? ",redditors worked celebrities dont
AskReddit,What’s one truth about life that nobody warns you about?,,fddssdhyyyyyyyyy,611,731,2025-12-02 14:46:12+00:00,whats truth life nobody warns,,What’s one truth about life that nobody warns you about? ,whats truth life nobody warns
AskReddit,What did you do this morning as soon as you woke up?,,Outrageous-One-705,521,1843,2025-12-02 14:05:34+00:00,morning soon woke,,What did you do this morning as soon as you woke up? ,morning soon woke
AskReddit,How would you feel if the U.S. government made Election Day an official national holiday for everyone?,,Mariam1S,425,305,2025-12-02 16:05:12+00:00,feel us government made election day official national holiday everyone,,How would you feel if the U.S. government made Election Day an official national holiday for everyone? ,feel us government made election day official national holiday everyone
AskReddit,What’s a rule you were taught as a kid that you later realized was completely made up?,,SpiritualFig9994,268,587,2025-12-02 15:49:33+00:00,whats rule taught kid later realized completely made,,What’s a rule you were taught as a kid that you later realized was completely made up? ,whats rule taught kid later realized completely made
AskReddit,What's the worst song you ever heard?,,Mission_Elk_329,210,1078,2025-12-02 16:04:48+00:00,whats worst song ever heard,,What's the worst song you ever heard? ,whats worst song ever heard
AskReddit,"What is a 'luxury' that has quietly become a necessity for you, and now you can't go back?",,Top_Temperature6582,187,650,2025-12-02 14:32:08+00:00,luxury quietly become necessity cant back,,"What is a 'luxury' that has quietly become a necessity for you, and now you can't go back? ",luxury quietly become necessity cant back
AskReddit,If you died and everyone said “They died doing what they loved.”  What was it that you were doing?,,lukepaciocco,87,442,2025-12-02 19:55:20+00:00,died everyone died loved,,If you died and everyone said “They died doing what they loved.”  What was it that you were doing? ,died everyone died loved
AskReddit,What industry is so powerful that we don't question their control of us?,,_marimbae,69,158,2025-12-02 17:03:28+00:00,industry powerful dont question control us,,What industry is so powerful that we don't question their control of us? ,industry powerful dont question control us
AskReddit,"If your life was a video game, what 'loading screen tip' would you see right now?",,emotionprocessor,54,106,2025-12-02 18:39:09+00:00,life video game loading screen tip right,,"If your life was a video game, what 'loading screen tip' would you see right now? ",life video game loading screen tip right
AskReddit,What’s a smell you instantly associate with your childhood?,,Manojnaidu13,46,192,2025-12-02 18:43:33+00:00,whats smell instantly associate childhood,,What’s a smell you instantly associate with your childhood? ,whats smell instantly associate childhood
AskReddit,"What’s one “broke habit” you’re keeping for life, even if you ended up filthy rich?",,Remote-Lawyer-2462,35,133,2025-12-02 20:29:01+00:00,whats broke habit youre keeping life ended filthy rich,,"What’s one “broke habit” you’re keeping for life, even if you ended up filthy rich? ",whats broke habit youre keeping life ended filthy rich
mentalhealth,"My college roommate’s porn addiction spiraled so badly he got kicked out of the dorms, and I still don’t know how to process it","So… this is something I never expected to write, but after everything that happened this semester, I need to get it out of my system.

I go to a pretty normal mid-sized university. Nothing fancy. At the start of the year, housing assigned me a random roommate—let’s call him *D*. When we first met, he seemed quiet, awkward, but friendly enough. He was a comp-sci major who mostly kept to himself, liked energy drinks a little too much, and played a ton of gacha games. Honestly, he reminded me of half the guys I know.

Everything seemed normal for the first month. He’d stay up late, but whatever—college. Then slowly… things got weird.

At first, I noticed he’d close his laptop really fast whenever I walked in. Again… fine. We’re all adults. But it kept happening. Sometimes at 3–4 AM when I’d wake up to use the bathroom and see the glow of his screen. Then I started finding tissues on the desk, earbuds on the floor, his laptop open with incognito tabs still visible. Awkward, but not a crisis… until it escalated.

The dude stopped going to class. Not just here and there—like WEEKS at a time. He barely left the room except to grab vending machine snacks. I’d come back from lectures and hear… very obvious audio coming from behind his headphones. Even when I made noise, even when I said I was entering. He just didn’t care anymore.

The turning point was when our RA did room inspections.

I had warned him the night before, and he said “yeah yeah, don’t worry.” Spoiler: he absolutely *did not* worry.

The RA knocked, we said come in, and D—**I swear to god**—still had a video playing on his screen. Full volume because his headphones had unplugged slightly. The RA just froze. I froze. D froze about two seconds later when he realized it wasn’t me who walked in.

The RA told him to close it, but you could tell he was trying to be professional while dying inside.

After that, we got a meeting scheduled with housing. I thought he’d get a warning. What I *didn’t* know was that this wasn’t D’s first report.

Apparently other people on our floor had complained earlier about weird noises through the walls, late-night slamming sounds, and someone seeing explicit content on his screen through the door window when walking past. They had talked to him before and he brushed it off.

Housing sent him to counseling. He skipped. They set up another meeting. He didn’t go. They warned him he could lose his dorm privileges if he kept violating behavior rules.

He kept doing it.

Fast-forward a bit: two weeks later, at around midnight, he was watching stuff with the volume ON—like, full speakers—because he “thought I wouldn’t be back for a while.” Someone on our floor called the RA again. This time it went straight up the chain.

Three days later, he was officially removed from on-campus housing for repeated conduct violations and refusing to comply with the support plan they tried to create for him. They gave him 24 hours to pack and leave.

It left me weirdly shaken. I can’t tell if I feel sorry for him, frustrated, secondhand embarrassed, or all of the above.

Anyway… thanks to anyone who actually read all this. I just needed to unload the story somewhere.",Levitating_Moose,290,40,2025-12-01 20:27:28+00:00,college roommates porn addiction spiraled badly got kicked dorms dont process,something never expected write everything happened semester system pretty normal midsized university nothing fancy start year housing assigned random roommatelets call first met seemed quiet awkward friendly enough compsci major mostly kept liked energy drinks little played ton gacha games honestly reminded half guys everything seemed normal first month hed stay late whatevercollege slowly got weird first noticed hed close laptop fast whenever walked fine adults kept happening sometimes id wake use bathroom glow screen started finding tissues desk earbuds floor laptop open incognito tabs visible awkward crisis escalated dude stopped going class therelike weeks time barely left room except grab vending machine snacks id come back lectures hear obvious audio coming behind headphones made noise entering didnt care anymore turning point ra room inspections warned night yeah yeah dont worry spoiler absolutely worry ra knocked come di swear godstill video playing screen full volume headphones unplugged slightly ra froze froze froze two seconds later realized wasnt walked ra told close tell trying professional dying inside got meeting scheduled housing thought hed warning didnt wasnt ds first report apparently floor complained earlier weird noises walls latenight slamming sounds someone seeing explicit content screen door window walking past talked brushed housing sent counseling skipped set another meeting didnt warned lose dorm privileges kept violating behavior rules kept fastforward bit two weeks later around midnight watching stuff volume onlike full speakersbecause thought wouldnt back someone floor called ra time went straight chain three days later officially removed oncampus housing repeated conduct violations refusing comply support plan tried create gave hours pack leave left weirdly shaken cant tell feel sorry frustrated secondhand embarrassed anyway thanks anyone actually read needed unload story somewhere,"My college roommate’s porn addiction spiraled so badly he got kicked out of the dorms, and I still don’t know how to process it So… this is something I never expected to write, but after everything that happened this semester, I need to get it out of my system.

I go to a pretty normal mid-sized university. Nothing fancy. At the start of the year, housing assigned me a random roommate—let’s call him *D*. When we first met, he seemed quiet, awkward, but friendly enough. He was a comp-sci major who mostly kept to himself, liked energy drinks a little too much, and played a ton of gacha games. Honestly, he reminded me of half the guys I know.

Everything seemed normal for the first month. He’d stay up late, but whatever—college. Then slowly… things got weird.

At first, I noticed he’d close his laptop really fast whenever I walked in. Again… fine. We’re all adults. But it kept happening. Sometimes at 3–4 AM when I’d wake up to use the bathroom and see the glow of his screen. Then I started finding tissues on the desk, earbuds on the floor, his laptop open with incognito tabs still visible. Awkward, but not a crisis… until it escalated.

The dude stopped going to class. Not just here and there—like WEEKS at a time. He barely left the room except to grab vending machine snacks. I’d come back from lectures and hear… very obvious audio coming from behind his headphones. Even when I made noise, even when I said I was entering. He just didn’t care anymore.

The turning point was when our RA did room inspections.

I had warned him the night before, and he said “yeah yeah, don’t worry.” Spoiler: he absolutely *did not* worry.

The RA knocked, we said come in, and D—**I swear to god**—still had a video playing on his screen. Full volume because his headphones had unplugged slightly. The RA just froze. I froze. D froze about two seconds later when he realized it wasn’t me who walked in.

The RA told him to close it, but you could tell he was trying to be professional while dying inside.

After that, we got a meeting scheduled with housing. I thought he’d get a warning. What I *didn’t* know was that this wasn’t D’s first report.

Apparently other people on our floor had complained earlier about weird noises through the walls, late-night slamming sounds, and someone seeing explicit content on his screen through the door window when walking past. They had talked to him before and he brushed it off.

Housing sent him to counseling. He skipped. They set up another meeting. He didn’t go. They warned him he could lose his dorm privileges if he kept violating behavior rules.

He kept doing it.

Fast-forward a bit: two weeks later, at around midnight, he was watching stuff with the volume ON—like, full speakers—because he “thought I wouldn’t be back for a while.” Someone on our floor called the RA again. This time it went straight up the chain.

Three days later, he was officially removed from on-campus housing for repeated conduct violations and refusing to comply with the support plan they tried to create for him. They gave him 24 hours to pack and leave.

It left me weirdly shaken. I can’t tell if I feel sorry for him, frustrated, secondhand embarrassed, or all of the above.

Anyway… thanks to anyone who actually read all this. I just needed to unload the story somewhere.",college roommates porn addiction spiraled badly got kicked dorms dont process something never expected write everything happened semester system pretty normal midsized university nothing fancy start year housing assigned random roommatelets call first met seemed quiet awkward friendly enough compsci major mostly kept liked energy drinks little played ton gacha games honestly reminded half guys everything seemed normal first month hed stay late whatevercollege slowly got weird first noticed hed close laptop fast whenever walked fine adults kept happening sometimes id wake use bathroom glow screen started finding tissues desk earbuds floor laptop open incognito tabs visible awkward crisis escalated dude stopped going class therelike weeks time barely left room except grab vending machine snacks id come back lectures hear obvious audio coming behind headphones made noise entering didnt care anymore turning point ra room inspections warned night yeah yeah dont worry spoiler absolutely worry ra knocked come di swear godstill video playing screen full volume headphones unplugged slightly ra froze froze froze two seconds later realized wasnt walked ra told close tell trying professional dying inside got meeting scheduled housing thought hed warning didnt wasnt ds first report apparently floor complained earlier weird noises walls latenight slamming sounds someone seeing explicit content screen door window walking past talked brushed housing sent counseling skipped set another meeting didnt warned lose dorm privileges kept violating behavior rules kept fastforward bit two weeks later around midnight watching stuff volume onlike full speakersbecause thought wouldnt back someone floor called ra time went straight chain three days later officially removed oncampus housing repeated conduct violations refusing comply support plan tried create gave hours pack leave left weirdly shaken cant tell feel sorry frustrated secondhand embarrassed anyway thanks anyone actually read needed unload story somewhere
