subreddit,title,body,author,upvotes,num_comments,timestamp,cleaned_title,cleaned_body,full_text,cleaned_full_text
mentalhealth,Point of life?,"Hi, I'm 15, struggling with mental health. My life feels very difficult at the moment and I actually just wanna know what I'm doing all this for?

I'm not religious, I don't believe in any god and don't want to. (For very good reasons. But I'm not in the mood to have discussions about that)

What's the point of life? Why am I here

I'm sorry if this is the wrong community to post this in but idk where else to post it.

Idk if this helps: I'm in therapy and taking medication prescribed by my psychiatrist. I have an autistic burnout. I'm always overstimulated, that's what the meds are for, but they don't help. I think i have social anxiety and now I'm too scared to go to school. the anxiety makes my burnout worse. 
I don't have any hobbies, I spend my days lying in bed or walking around my room while listening to music. I don't enjoy doing anything and I don't have friends. There's nothing I look forward to which makes it quite difficult to wanna live, so I REALLY need a reason to live or a point in life.


Sorry if this is chaotic, my brain is just kinda like that atm",2002VE68,7,3,2025-12-02 14:42:00+00:00,point life,hi im struggling mental health life feels difficult moment actually wan na im im religious dont believe god dont reasons im mood discussions whats point life im sorry wrong community post idk else post idk helps im therapy taking medication prescribed psychiatrist autistic burnout im always overstimulated thats meds dont help social anxiety im scared school anxiety makes burnout worse dont hobbies spend days lying bed walking around room listening music dont enjoy anything dont friends theres nothing look forward makes quite difficult wan na live reason live point life sorry chaotic brain kinda atm,"Point of life? Hi, I'm 15, struggling with mental health. My life feels very difficult at the moment and I actually just wanna know what I'm doing all this for?

I'm not religious, I don't believe in any god and don't want to. (For very good reasons. But I'm not in the mood to have discussions about that)

What's the point of life? Why am I here

I'm sorry if this is the wrong community to post this in but idk where else to post it.

Idk if this helps: I'm in therapy and taking medication prescribed by my psychiatrist. I have an autistic burnout. I'm always overstimulated, that's what the meds are for, but they don't help. I think i have social anxiety and now I'm too scared to go to school. the anxiety makes my burnout worse. 
I don't have any hobbies, I spend my days lying in bed or walking around my room while listening to music. I don't enjoy doing anything and I don't have friends. There's nothing I look forward to which makes it quite difficult to wanna live, so I REALLY need a reason to live or a point in life.


Sorry if this is chaotic, my brain is just kinda like that atm",point life hi im struggling mental health life feels difficult moment actually wan na im im religious dont believe god dont reasons im mood discussions whats point life im sorry wrong community post idk else post idk helps im therapy taking medication prescribed psychiatrist autistic burnout im always overstimulated thats meds dont help social anxiety im scared school anxiety makes burnout worse dont hobbies spend days lying bed walking around room listening music dont enjoy anything dont friends theres nothing look forward makes quite difficult wan na live reason live point life sorry chaotic brain kinda atm
mentalhealth,how do i stop caring so much about myself?,"for the last few years i’ve been stuck in this loop of hating everything about myself. i keep trying hobbies (crocheting, painting, random diy stuff) hoping they’ll distract me from thinking about how i look or how dumb i feel… but honestly it just makes me feel worse. i end up thinking i’m even more useless because i suck at those things too.

the part that hurts the most is how i feel when i look at myself. i get so disgusted. i don’t even feel like a woman, just because i think i’m too ugly. i feel like literally nothing about me is good—every single part of me is messed up or ugly.

it makes me jealous of other women, and i hate that feeling. i’ve become so bitter watching everyone else be prettier, like there’s no point in my life if i look like this.

and it’s not just appearance. i feel stupid, like my personality is awful. i don’t really have close friends. just one, and we’re not that close. i’ve never had a boyfriend either, and it just makes me feel like my life is already over before it even started.

i’ve been feeling like this for around 3 years. i know therapy would probably help but i’m honestly terrified of going, and the therapists around where i live don’t seem great anyway.

i just… don’t know how to stop caring so much about myself in this toxic way. how do people do it? any advice?",XKXKXKXXKXKXK,6,7,2025-12-02 18:06:30+00:00,stop caring,last years ive stuck loop hating everything keep trying hobbies crocheting painting random diy stuff hoping theyll distract thinking look dumb feel honestly makes feel worse end thinking im useless suck part hurts feel look disgusted dont feel woman im ugly feel literally nothing goodevery single part messed ugly makes jealous women hate feeling ive become bitter watching everyone else prettier theres point life look appearance feel stupid personality awful dont close friends close ive never boyfriend either makes feel life already started ive feeling around years therapy probably help im honestly terrified going therapists around live dont seem great anyway dont stop caring toxic way advice,"how do i stop caring so much about myself? for the last few years i’ve been stuck in this loop of hating everything about myself. i keep trying hobbies (crocheting, painting, random diy stuff) hoping they’ll distract me from thinking about how i look or how dumb i feel… but honestly it just makes me feel worse. i end up thinking i’m even more useless because i suck at those things too.

the part that hurts the most is how i feel when i look at myself. i get so disgusted. i don’t even feel like a woman, just because i think i’m too ugly. i feel like literally nothing about me is good—every single part of me is messed up or ugly.

it makes me jealous of other women, and i hate that feeling. i’ve become so bitter watching everyone else be prettier, like there’s no point in my life if i look like this.

and it’s not just appearance. i feel stupid, like my personality is awful. i don’t really have close friends. just one, and we’re not that close. i’ve never had a boyfriend either, and it just makes me feel like my life is already over before it even started.

i’ve been feeling like this for around 3 years. i know therapy would probably help but i’m honestly terrified of going, and the therapists around where i live don’t seem great anyway.

i just… don’t know how to stop caring so much about myself in this toxic way. how do people do it? any advice?",stop caring last years ive stuck loop hating everything keep trying hobbies crocheting painting random diy stuff hoping theyll distract thinking look dumb feel honestly makes feel worse end thinking im useless suck part hurts feel look disgusted dont feel woman im ugly feel literally nothing goodevery single part messed ugly makes jealous women hate feeling ive become bitter watching everyone else prettier theres point life look appearance feel stupid personality awful dont close friends close ive never boyfriend either makes feel life already started ive feeling around years therapy probably help im honestly terrified going therapists around live dont seem great anyway dont stop caring toxic way advice
mentalhealth,Managing mental health without meds,Is it even possible any tips? I’ve been struggling with severe depression and suicidal ideation for a while and it’s only continued to get worse everything I’ve tried hasn’t helped much I’ve started working out trying to eat better but it still hasn’t helped I want to get help I just don’t want to use meds due to horrible experiences with them in the past,W00zers,5,3,2025-12-02 13:48:00+00:00,managing mental health without meds,possible tips ive struggling severe depression suicidal ideation continued worse everything ive tried hasnt helped ive started working trying eat better hasnt helped help dont use meds due horrible experiences past,Managing mental health without meds Is it even possible any tips? I’ve been struggling with severe depression and suicidal ideation for a while and it’s only continued to get worse everything I’ve tried hasn’t helped much I’ve started working out trying to eat better but it still hasn’t helped I want to get help I just don’t want to use meds due to horrible experiences with them in the past,managing mental health without meds possible tips ive struggling severe depression suicidal ideation continued worse everything ive tried hasnt helped ive started working trying eat better hasnt helped help dont use meds due horrible experiences past
mentalhealth,"Incident happened with mom, now I am remembering things.","I am 43(M) if that matters. 

About a month ago, I went to my parents' house to visit my mom. I knew dad was at work, but was just stopping by to say hello. Walked in on mom with another man. Anger instantly went through the roof, I told the guy to get dressed and get TF out. 

I yelled at mom, very harshly. She needed to hear those words, and after I left I have not been in contact with her whatsoever. Dad is doing OK.  Much better than I would be in this situation. 

  
It took me a solid two weeks to calm my mind down about that situation to be able to form rational thoughts about things. In doing this, bits and pieces from the past, say when I was age 7 - 12 keep popping into my mind, and when thinking about them now, it sure seems like mom has been cheating on dad for a while. 

  
I keep having random memories come out now since that day, and I don't know how to feel about it. Is my own personal mental health collapsing? I can still function just fine daily, it just is worrisome that I can just be plugging away at work and all of a sudden, my brain is in 1992 and a confused kid.  Easy enough to snap out of, but it is something I am not familiar with. 

Is this common after an incident like this?

  
Thanks for reading. 

",PaulWithAPH,5,4,2025-12-02 14:49:52+00:00,incident happened mom remembering,matters month ago went parents house visit mom knew dad work stopping say hello walked mom another man anger instantly went roof told guy dressed tf yelled mom harshly needed hear words left contact whatsoever dad ok better situation took solid two weeks calm mind situation able form rational thoughts bits pieces past say age keep popping mind thinking sure seems mom cheating dad keep random memories come since day dont feel personal mental health collapsing function fine daily worrisome plugging away work sudden brain confused kid easy enough snap something familiar common incident thanks reading,"Incident happened with mom, now I am remembering things. I am 43(M) if that matters. 

About a month ago, I went to my parents' house to visit my mom. I knew dad was at work, but was just stopping by to say hello. Walked in on mom with another man. Anger instantly went through the roof, I told the guy to get dressed and get TF out. 

I yelled at mom, very harshly. She needed to hear those words, and after I left I have not been in contact with her whatsoever. Dad is doing OK.  Much better than I would be in this situation. 

  
It took me a solid two weeks to calm my mind down about that situation to be able to form rational thoughts about things. In doing this, bits and pieces from the past, say when I was age 7 - 12 keep popping into my mind, and when thinking about them now, it sure seems like mom has been cheating on dad for a while. 

  
I keep having random memories come out now since that day, and I don't know how to feel about it. Is my own personal mental health collapsing? I can still function just fine daily, it just is worrisome that I can just be plugging away at work and all of a sudden, my brain is in 1992 and a confused kid.  Easy enough to snap out of, but it is something I am not familiar with. 

Is this common after an incident like this?

  
Thanks for reading. 

",incident happened mom remembering matters month ago went parents house visit mom knew dad work stopping say hello walked mom another man anger instantly went roof told guy dressed tf yelled mom harshly needed hear words left contact whatsoever dad ok better situation took solid two weeks calm mind situation able form rational thoughts bits pieces past say age keep popping mind thinking sure seems mom cheating dad keep random memories come since day dont feel personal mental health collapsing function fine daily worrisome plugging away work sudden brain confused kid easy enough snap something familiar common incident thanks reading
mentalhealth,I can't enjoy anything that's even remotely popular.,"I can't, but I'd want to enjoy things, like a normal human. Whenever something I do like gets brought up, I feel like I enjoy that thing less and less. There's also a reaction, like I'm threatened, I feel kinda stressed out and a little angry. I don't want to be like that. I don't know what tags to add, because I doubt that anyone could help with this. Maybe I'm not meant to enjoy anything. I don't enjoy living anyway, so not enjoying music or a movie doesn't matter either way.",bigpoo9,3,1,2025-12-02 20:28:34+00:00,cant enjoy anything thats remotely popular,cant id enjoy normal human whenever something gets brought feel enjoy less less theres reaction im threatened feel kinda stressed little angry dont dont tags add doubt anyone help im meant enjoy anything dont enjoy living anyway enjoying music movie doesnt matter either way,"I can't enjoy anything that's even remotely popular. I can't, but I'd want to enjoy things, like a normal human. Whenever something I do like gets brought up, I feel like I enjoy that thing less and less. There's also a reaction, like I'm threatened, I feel kinda stressed out and a little angry. I don't want to be like that. I don't know what tags to add, because I doubt that anyone could help with this. Maybe I'm not meant to enjoy anything. I don't enjoy living anyway, so not enjoying music or a movie doesn't matter either way.",cant enjoy anything thats remotely popular cant id enjoy normal human whenever something gets brought feel enjoy less less theres reaction im threatened feel kinda stressed little angry dont dont tags add doubt anyone help im meant enjoy anything dont enjoy living anyway enjoying music movie doesnt matter either way
mentalhealth,im thinking about giving up. i dont know who to reach out to,"
<18 f. i had to move to england 5 or so years ago from my home country due to political issues. ever since ive arrived i have felt the pressure to try extra hard since i felt like i was born with some sort of disadvantage compared to my friends who were born and raised in this country

this has recently gotten worse with exams. i began harming myself a year ago now, and i also have other coping mechanisms which im too ashamed to admit.

i dont know what to do. ive thought about giving up multiple times. nothing i do feels enough. im never happy with my grades or my talents or my extracurriculars. i dont see a future ahead of myself. 

i dont know how healthcare works here. my parents are already struggling and i dont want them to also pay money for my mental health. the free healthcare (nhs) has long queues and i dont exactly know how it works (like ive said) at some point considering reaching out began feeling pointless too.

i feel like im becoming a bad person. i feel jealous when my friends perform well, and i cant feel sorry for them when they vent about their problems (because in my head ""what theyre experiencing is nowhere bad enough"") i never tell this to them. i dont want to hurt the people around me but i can understand that these are not good thoughts to have. i am insecure.

i doubt many people will see this. i dont really know why im posting this here. it just feels like im living a life that nobody else can relate to and nobody else can truly understand. i just want to be happy with myself and i tried so hard to but i cant. im tired.

im meant to map out a future for myself by now. focus on my academics, my connections, my skills. but i cant see one for myself at all. my life feels like a waste

what do i do? is there anything i can do?",KittyMuffinx,3,3,2025-12-02 19:31:59+00:00,im thinking giving dont reach,f move england years ago home country due political issues ever since ive arrived felt pressure try extra hard since felt born sort disadvantage compared friends born raised country recently gotten worse exams began harming year ago coping mechanisms im ashamed admit dont ive thought giving multiple times nothing feels enough im never happy grades talents extracurriculars dont future ahead dont healthcare works parents already struggling dont pay money mental health free healthcare nhs long queues dont exactly works ive point considering reaching began feeling pointless feel im becoming bad person feel jealous friends perform well cant feel sorry vent problems head theyre experiencing nowhere bad enough never tell dont hurt around understand thoughts insecure doubt dont im posting feels im living life nobody else relate nobody else truly understand happy tried hard cant im tired im meant map future focus academics connections skills cant life feels waste anything,"im thinking about giving up. i dont know who to reach out to 
<18 f. i had to move to england 5 or so years ago from my home country due to political issues. ever since ive arrived i have felt the pressure to try extra hard since i felt like i was born with some sort of disadvantage compared to my friends who were born and raised in this country

this has recently gotten worse with exams. i began harming myself a year ago now, and i also have other coping mechanisms which im too ashamed to admit.

i dont know what to do. ive thought about giving up multiple times. nothing i do feels enough. im never happy with my grades or my talents or my extracurriculars. i dont see a future ahead of myself. 

i dont know how healthcare works here. my parents are already struggling and i dont want them to also pay money for my mental health. the free healthcare (nhs) has long queues and i dont exactly know how it works (like ive said) at some point considering reaching out began feeling pointless too.

i feel like im becoming a bad person. i feel jealous when my friends perform well, and i cant feel sorry for them when they vent about their problems (because in my head ""what theyre experiencing is nowhere bad enough"") i never tell this to them. i dont want to hurt the people around me but i can understand that these are not good thoughts to have. i am insecure.

i doubt many people will see this. i dont really know why im posting this here. it just feels like im living a life that nobody else can relate to and nobody else can truly understand. i just want to be happy with myself and i tried so hard to but i cant. im tired.

im meant to map out a future for myself by now. focus on my academics, my connections, my skills. but i cant see one for myself at all. my life feels like a waste

what do i do? is there anything i can do?",im thinking giving dont reach f move england years ago home country due political issues ever since ive arrived felt pressure try extra hard since felt born sort disadvantage compared friends born raised country recently gotten worse exams began harming year ago coping mechanisms im ashamed admit dont ive thought giving multiple times nothing feels enough im never happy grades talents extracurriculars dont future ahead dont healthcare works parents already struggling dont pay money mental health free healthcare nhs long queues dont exactly works ive point considering reaching began feeling pointless feel im becoming bad person feel jealous friends perform well cant feel sorry vent problems head theyre experiencing nowhere bad enough never tell dont hurt around understand thoughts insecure doubt dont im posting feels im living life nobody else relate nobody else truly understand happy tried hard cant im tired im meant map future focus academics connections skills cant life feels waste anything
mentalhealth,I feel like life is too loud and I don’t know how to cope anymore,"Everything has been overwhelming lately. My thoughts, my responsibilities, my emotions—everything feels louder than usual. I’m trying to keep it together but inside I feel like I’m falling apart quietly.

I’ve been isolating myself because it feels easier than trying to explain what’s going on. I’m struggling with sadness, worry, and loneliness all at once. It’s like my mental health is slipping in ways I don’t know how to control.

I’m not looking for solutions—just a bit of understanding or connection from someone who has been through something similar. Sometimes just knowing someone is listening can make things feel a little lighter.",humbleboy12,3,4,2025-12-02 15:50:43+00:00,feel life loud dont cope anymore,everything overwhelming lately thoughts responsibilities emotionseverything feels louder usual im trying keep together inside feel im falling apart quietly ive isolating feels easier trying explain whats going im struggling sadness worry loneliness mental health slipping ways dont control im looking solutionsjust bit understanding connection someone something similar sometimes knowing someone listening feel little lighter,"I feel like life is too loud and I don’t know how to cope anymore Everything has been overwhelming lately. My thoughts, my responsibilities, my emotions—everything feels louder than usual. I’m trying to keep it together but inside I feel like I’m falling apart quietly.

I’ve been isolating myself because it feels easier than trying to explain what’s going on. I’m struggling with sadness, worry, and loneliness all at once. It’s like my mental health is slipping in ways I don’t know how to control.

I’m not looking for solutions—just a bit of understanding or connection from someone who has been through something similar. Sometimes just knowing someone is listening can make things feel a little lighter.",feel life loud dont cope anymore everything overwhelming lately thoughts responsibilities emotionseverything feels louder usual im trying keep together inside feel im falling apart quietly ive isolating feels easier trying explain whats going im struggling sadness worry loneliness mental health slipping ways dont control im looking solutionsjust bit understanding connection someone something similar sometimes knowing someone listening feel little lighter
mentalhealth,How should I go about this ?,"I want to go to a psych ward or whatever but Idk how to talk with my dad about it (for context we are living together and hes the Only family I  have left).My Dad is a kind person but when I talk about anything concerning my Mental health he just shrugs me off.It may be because he can't comprehend me being suicidal and stuff.Im actually at my breaking point and im about to do ""it"" (you guys proably know what I mean by ""it"").I also tend to cope in a really bad way (Self harm).I just don't know what to do,I've tried therapy and some over the Counter medication but nothing worked.I just need advice on how I should deal with this situation.Thanks :D ",Hell2009,3,0,2025-12-02 15:00:03+00:00,,psych ward whatever idk talk dad context living together hes family leftmy dad kind person talk anything concerning mental health shrugs offit may cant comprehend suicidal stuffim actually breaking point im guys proably mean iti tend cope bad way self harmi dont doive tried therapy counter medication nothing workedi advice deal situationthanks,"How should I go about this ? I want to go to a psych ward or whatever but Idk how to talk with my dad about it (for context we are living together and hes the Only family I  have left).My Dad is a kind person but when I talk about anything concerning my Mental health he just shrugs me off.It may be because he can't comprehend me being suicidal and stuff.Im actually at my breaking point and im about to do ""it"" (you guys proably know what I mean by ""it"").I also tend to cope in a really bad way (Self harm).I just don't know what to do,I've tried therapy and some over the Counter medication but nothing worked.I just need advice on how I should deal with this situation.Thanks :D ",psych ward whatever idk talk dad context living together hes family leftmy dad kind person talk anything concerning mental health shrugs offit may cant comprehend suicidal stuffim actually breaking point im guys proably mean iti tend cope bad way self harmi dont doive tried therapy counter medication nothing workedi advice deal situationthanks
